idx_all,idx,english,french,ALL VOTEINTENTION,ALL CRITICISM,ALL SUPPORT,MACRON VOTEINTENTION,LEPEN VOTEINTENTION,MELENCHON VOTEINTENTION,MACRON CRITICISM,LEPEN CRITICISM,MELENCHON CRITICISM,MACRON  SUPPORT,LEPEN SUPPORT,MELENCHON SUPPORT
3413836,0,"Me, MLP in first, Mélenchon in second and Macron in third. In my polling station, MLP comes in first. Nice neighbors in the neighborhood.","Moi MLP en première, Mélenchon en 2 ème et Macron en 3 ème. Dans mon bureau de vote c'est MLP qui arrive en 1er. Sympa les voisins du quartier. ",None,None,None,NO,NO,NO,NO,NO,NO,NO,NO,NO
3486702,1,Mélenchon is a loser he yells he barks every 5 years he has fun in meetings every 5 years he loses and every 5 years he cries this is called fatality Mélenchon no build of head of state,Mélenchon est un looser il hurle il aboie tous les 5 ans il s'éclate en meeting tous les 5 ans il perd et tous les 5 ans il pleure cela s'appelle la fatalité  Mélenchon aucune carrure de chef d'État,None,Mélenchon,None,NO,NO,NO,NO,NO,YES,NO,NO,NO
4559452,2,"If your character had been able to create a real dynamic like your guru (Mitrand) did, we wouldn't be here. We'll shut our mouths and grit our teeth for 5 years.",Si votre caracteriel avait su créer une vraie dynamique telle que sou gourou l’avait faite (Mitrand) on n’en serait pas là.  On ferme notre claquemerde et on va serrer les dents pendant 5 ans.,None,None,None,NO,NO,NO,NO,NO,NO,NO,NO,NO
4842303,3,"An anti-Zemmour African, how SURPRISED I am","Un Africains anti-Zemmour, comme je suis SURPRIS",None,None,None,NO,NO,NO,NO,NO,NO,NO,NO,NO
5537959,4,Macron is self-sufficient in harming himself; he doesn't know how to express himself without lying or being insulting. Everything but Macron,"macron se suffit à lui même pour se nuire, il ne sait pas s'exprimer sans mentir, sans être insultant. ToutsaufMacron",None,Macron,None,NO,NO,NO,YES,NO,NO,NO,NO,NO
3357643,5,"Lie! France represents nothing in the issue of global warming! Grand max 0.5% of emissions, or 0.5cl per liter when transposed to a bottle of water! will not be president of China or the USA!","Mensonge ! La France ne représente rien dans la problématique du réchauffement climatique ! Grand max 0,5% des émissions, soit 0,5cl par litre en transposant sur une bouteille d’eau !  ne sera pas président de la Chine ou des USA!",None,None,None,NO,NO,NO,NO,NO,NO,NO,NO,NO
4427195,6,Abstaining means voting for Macron. Take a real position. One or the other.,S abstenir en vient à voter Macron. Prenez une vraie position .l un ou l autre,None,Macron,None,NO,NO,NO,YES,NO,NO,NO,NO,NO
533052,7,"Soon the goodbyes, the walking lie.","Bientôt les adieux, le mensonge ambulant.",None,None,None,NO,NO,NO,NO,NO,NO,NO,NO,NO
4068010,8,"For those who still think that belonging to the Greens is enough to be an environmentalist, Mélenchon once again has the most solid program.",Pour ceux qui pensent encore qu'il suffit d'appartenir à EELV pour être écologiste. Mélenchon a là encore le programme le plus solide.,None,None,Mélenchon,NO,NO,NO,NO,NO,NO,NO,NO,YES
812627,9,It would be so funny if JLM were to beat MLP! All the speeches this evening from politicians and journalists would be thrown in the trash!,Ce serait trop drôle si JLM passait devant MLP ! Tous les discours de ce soir des politiques et des journalistes seraient à mettre à la poubelle !,None,None,None,NO,NO,NO,NO,NO,NO,NO,NO,NO
2547820,10,The BDE is officially reappointed Macron,Le BDE est officiellement reconduit   Macron,None,None,None,NO,NO,NO,NO,NO,NO,NO,NO,NO
2788860,11,The little scamps of contempt for the toothless... they put up with a hairy Macron snorting a line before dying under the imminent chaos,Les greluches du mépris des sans-dents... elles s'accommodent tant et tant d'un Macron velu & sniffant une ligne avant de crever sous le chaos imminent,None,None,None,NO,NO,NO,NO,NO,NO,NO,NO,NO
2742547,12,"The pro-Zemmour people are anti-immigration but in their morals they are very left-wing, it's the same for a lot of far-right supporters in France.",Les Pro-Zemmour sont anti immigration mais dans les mœurs il sont tres a gauche c’est pareil pour énormément de partisans d’extrême droite en France,None,None,None,NO,NO,NO,NO,NO,NO,NO,NO,NO
5345832,13,"So a minister, in full office, comes to shed light in a totally partisan way, under false guise of defending democracy, on attacks against the state? False, the attacks target candidate Macron, not the state... manipulation by Montchagrin McKinseyMacronGate","donc une ministre, en plein exercice vient éclairer de façon totalement partisane, sous de faux airs de défense de la démocratie, des attaques envers l'état? Faux, les attaques visent le candidat Macron, pas l'état...manipulation la Montchagrin McKinseyMacronGate",None,Macron,None,NO,NO,NO,YES,NO,NO,NO,NO,NO
2920542,14,"MLP is a useless, harmful vote -","MLP c'est un vote inutile, nuisible -",None,Le Pen,None,NO,NO,NO,NO,YES,NO,NO,NO,NO
5710497,15,"hunted down the Nonvax better than the scum. At the same time, it’s Macron’s policy",traquait mieux les Nonvax que la racaille. EnMemeTemps c’est la politique de Macron,None,Macron,None,NO,NO,NO,YES,NO,NO,NO,NO,NO
26748,16,"""Mrs. Le Pen, I did not interrupt you.""","""Madame Lepen je ne vous ai pas interrompue"" ",None,None,None,NO,NO,NO,NO,NO,NO,NO,NO,NO
3063062,17,"Macron Melenchon in the second round, who are you voting for, Ismail?",Macron melenchon au 2ème tour tu votes pour qui ismaïl?,None,None,None,NO,NO,NO,NO,NO,NO,NO,NO,NO
1164033,18,So I have to put up with Macron's policies? LOL No,Donc je dois subir la politique de Macron ? MDRRRR Non,None,Macron,None,NO,NO,NO,YES,NO,NO,NO,NO,NO
2894111,19,Macron's car route suggests that the driver also took coke.,L’itinéraire de Macron en bagnole suggère que le chauffeur aussi a pris de la coke.,None,Macron,None,NO,NO,NO,YES,NO,NO,NO,NO,NO
2606911,20,"The debate wasn't up to scratch, but it must be said that Macron didn't miss you. A lack of mastery of certain issues on your part. In economics, it's a disaster. In short, the only thing Marine can lead is RN.",Le débat n'a pas été au niveau mais il faut dire  que Macron t'as pas loupé. Un manque de maîtrise de certains dossiers de ta part En économie c'est la cata bref la seule chose que Marine peut diriger c'est RN,None,Le Pen,None,NO,NO,NO,NO,YES,NO,NO,NO,NO
2520276,21,"Cheating in the Epads they took the electoral cards to make Macron vote 95% of the French do not want him and yet he is in the second round, a lot of cheating","La triche dans les epad ils ont pris les cartes electorales pour faire voter Macron  95% des francais ne le veulent pas et pourtant il est au deuxieme tour, énormément de triche ",None,Macron,None,NO,NO,NO,YES,NO,NO,NO,NO,NO
4811183,22,Do you prefer Macron and his mafia in power who are ruining France or the far right perhaps? Shut up a bit.,Tu préfères le macron et sa mafia au pouvoir qui sont en train de ruiner la france ou l’extrême-droite peut etre ? Fermez la un peu,None,Macron,None,NO,NO,NO,YES,NO,NO,NO,NO,NO
2824027,23,Delafosse's comments leave me particularly skeptical...,Les propos de Delafosse me laissent particulièrement sceptique…,None,None,None,NO,NO,NO,NO,NO,NO,NO,NO,NO
3547943,24,"Don't be fooled, they are trying to create fear around MARINE by talking about racism and hatred, which is very serious because it is the opposite of what she defends, find out for yourself. The danger is Macron who has been destroying our social achievements for 5 years.","Ne vous faites pas avoir, ils essayent de créer la peur autour de MARINE en parlant de racisme et de haine ce qui est très grave car c’est l’opposé de ce qu’elle défend, renseignez-vous par vous-même même. Le danger c’est Macron qui détruit nos acquis sociaux depuis 5 ans.",None,Macron,LePen,NO,NO,NO,YES,NO,NO,NO,NO,NO
1122582,25,"Didier, you're really pathetic! But hey, at 8:02 p.m. you'll be licking Macron's slippers!",Didier tu fais vraiment pitié !mais bon à 20h02 tu lécheras les babouches de Macron !,None,None,None,NO,NO,NO,NO,NO,NO,NO,NO,NO
5162320,26,There is no campaign Macron is the real PS candidate I will vote PS against the FN if necessary not Macron For Macron I will never vote MacronAssassin MacronGet out 580 tweets Presidentielle2022 The PS is 50% of the victories in the Regionals What is the disaster?,Y a pas de campagne Macron est le vrai candidat du PS Je voterai PS face au FN si il le faut pas Macron Pour Macron je voterai jamais MacronAssassin MacronDegage 580 tweets Presidentielle2022 Le PS c'est 50% des victoires aux Regionales C'est quoi la catastrophe?,None,Macron,None,NO,NO,NO,YES,NO,NO,NO,NO,NO
2687412,27,"Did you know? The Yellow Vests who were arrested had their civil rights (right to vote) revoked for 5 years, as the Macron law has stipulated for a year and a half... How convenient. Macron, the anti-democratic thug","Le saviez vous ? Les Gilets Jaunes qui ont été arrêtés se sont vus retirer leurs droits civiques (droit de vote) pendant 5 ans, comme la loi Macron le stipule depuis 1 an et demi.... Comme c'est commode. Macron voyou anti démocrate ",None,Macron,None,NO,NO,NO,YES,NO,NO,NO,NO,NO
1277363,28,She is a victim of the useful vote and has shown some courage. Why not?,Elle est victime du vote utile et à eu un certain courage. Pourquoi pas.,None,None,LePen,NO,NO,NO,NO,NO,NO,NO,NO,NO
4245186,29,"When fighting the ""far right"" is more important than saving our country. For France to Remain France. Macron Out of the First Round. I'm Voting for Zemmour on April 10th.","Quand combattre"" l’extrême droite"" est plus important que sauver notre pays PourQueLaFranceResteLaFrance  MacronDehorsDesLePremierTour  JeVoteZemmourLe10avril ",None,Macron,None,NO,NO,NO,YES,NO,NO,NO,NO,NO
3769560,30,We will win with JLM,On va gagner avec JLM,Mélenchon,None,Mélenchon,NO,NO,YES,NO,NO,NO,NO,NO,YES
4587987,31,"Wasn't her husband Bernard d'Ormale an advisor to Papa Le Pen? Jany Le Pen's girlfriend, BB, met her husband at a meal at her friend's house. So, she shuts up, collaborator.","Son mari Bernard d'Ormale n'était-il pas conseiller de papa le pen ? BB copine de Jany le pen, c'est lors d'un repas chez cette copine qu'elle rencontre son mari. Alors, la ferme collabo.",None,None,None,NO,NO,NO,NO,NO,NO,NO,NO,NO
3736960,32,We didn't hear you when today was on repeat for an hour on macron presidential election 2022 macron Macron Takes Us For Idiots macron out of the first round,On ne t’a pas entendu quand  aujourd’hui est resté 1h en boucle sur macron electionpresidentielle2022 macron MacronNousPrendPourDesCons macrondehorsdèslepremiertour,None,Macron,None,NO,NO,NO,YES,NO,NO,NO,NO,NO
1640896,33,"We have to stop making fun of us, there were 3 candidates, the rest was just for show and everyone knows it, then I voted MLP because E.M screwed us all over and is going to do it again, and I don't like JLM's positions on Nuclear, massive aid 1/2","Faut arrêter de ce foutre de notre gueule y avait 3 candidats, le reste c’était pour faire jolie et tout le monde le sait, ensuite j’ai voter MLP car E.M nous a tous entuber et va le refaire, et j’aime pas les positions de JLM sur le Nucléaire, les aides massives 1/2",Le Pen,Macron,LePen,NO,YES,NO,YES,NO,NO,NO,NO,NO
5735647,34,"Your studies must not be very brilliant given the little reflection you have. (and neither is spelling) I did not vote for Macron but for real and above all intelligent reasons,","vos études ne doivent pas être très brillantes vu le peu de réflexion que vous avez.   ( et l'orthographe non plus)  Moi je n'ai pas voté Macron mais pour des raisons vrais et surtout intelligentes ,",None,None,None,NO,NO,NO,NO,NO,NO,NO,NO,NO
4013126,35,"Personally, I fantasize about a second round between Melenchon and MLP. They are two old political thugs who don't really want to be elected President, and it would be enjoyable to see them make one hell of a mess after another so as not to inherit the hot potato!","Personnellement je fantasme sur un deuxième tours Melenchon  vs MLP . C'est deux vieux lascars de la politique ne souhaitant pas véritablement être élu Président, qu'il serait jouissif de les voire faire merdes sur merdes pour ne pas hériter de la patate chaude ! ",None,None,None,NO,NO,NO,NO,NO,NO,NO,NO,NO
4982997,36,"A useful vote, a principled one, who cares. It's over. Too late. We should have excluded Le Pen from the second round. Now, in the end, we'll have Le Pen as president. Too many people hate Macron.","Vote utile, de principe, on s'en fout. C'est plié. Trop tard. Il fallait dégager LePen du second tour. Là au final on aura Lepen présidente  Trop de monde déteste Macron.",None,Le Pen,None,NO,NO,NO,NO,YES,NO,NO,NO,NO
1475470,37,And to think that there are people on the left who are thinking of voting for Macron!,Et dire qu'il y a des gens de gauche qui pensent voter Macron !,None,Macron,None,NO,NO,NO,YES,NO,NO,NO,NO,NO
4917744,38,"YOU YOUNG PEOPLE: FORCED TO WORK MORE AND LONGER, TO PAY TAXES GALORE to plug the holes of social and tax fraud, we are planning a RETIREMENT THAT IS RECEDING ON THE HORIZON: it's the NEW Macron to consume in moderation. So, collaboration?","VOUS LES JEUNES : OBLIGES DE TRAVAILLER PLUS ET PLUS LONGTEMPS, de PAYER DES TAXES à GOGO pour boucher les trous des fraudes sociales et fiscales, on vous prévoit une RETRAITE QUI RECULE à L'HORIZON : c'est le NOUVEAU Macron à consommer avec modération . Alors collaboration ?",None,Macron,None,NO,NO,NO,YES,NO,NO,NO,NO,NO
3196575,39,"But public opinion is always divided, regardless of the president elected and the actions he takes, he is critical. If we give more power to the assembly and we decide to fire a president as soon as the people want it, how could he implement his program?",Mais l'opinion publique est toujours divisé quelque soit la president élu et les actes qu'il fait il est critique. Si on donne plus de pouvoir à l'assemblé et qu'on décide de virer un président des que le peuple le souhaite comment pourrais t il mettre en place son programme.,None,None,None,NO,NO,NO,NO,NO,NO,NO,NO,NO
2337179,40,I reported this tweet!,J’ai signalé ce tweet !,None,None,None,NO,NO,NO,NO,NO,NO,NO,NO,NO
2200770,41,"I respect but don't share. I'm more basic and prefer to give visibility to those who defend my convictions. It was already too painful in 2017 to have voted for Mélenchon to see the disaster of ideas that he made of it. In 2022, it's impossible","Je respecte mais partage pas. Je suis plus primaire et prefere donner de la visibilité à ceux qui defendent mes convictions. C etait deja trop douloureux en 2017 d’avoir voté melenchon pour constater le desastre d’idée qu’il en a fait. En 2022, c impossible",None,Mélenchon,None,NO,NO,NO,NO,NO,YES,NO,NO,NO
1226703,42,"Relax, it's Macron who's going to pass, you'll be able to stay.",Détends toi c’est macron qui va passer tu vas pouvoir rester,None,None,None,NO,NO,NO,NO,NO,NO,NO,NO,NO
3893647,43,MORE THAN THE SCUM WITH Mélenchon will CONTINUE ITS BABARIC ACTS! I ASK THE PARENTS OF DRUG ADDICTS AND TRAFFICKERS LIKE THUGS TO VOTE FOR MARINE LE PEN OR YOU RISK YOUR CHILDREN BEING IN PRISON OR BY OTHER GANGS OF DELINQUENTS!,"PLUS QUE LA RACAILLE AVEC mélenchon va CONTINUER SES ACTES BABARES !.JE DEMANDE AUX PARENTS DES DROGUES ET TRAFICANTS COMME DES VOYOUS,DE VOTER MARINE LE PEN OU VOUS RISQUEZ QUE VOS ENFANTS SOIENT EN PRISON OUPAR AUTRES BANDES DE DELINQUENTS !.",Le Pen,Mélenchon,LePen,NO,YES,NO,NO,NO,YES,NO,NO,NO
5516649,44,the old people who voted for marine lol it's because of them that jlm isn't here damn it,les vieux qui ont votés marine mdrrr c'est à cause d'eux que jlm n'est pas là putain,None,None,None,NO,NO,NO,NO,NO,NO,NO,NO,NO
4675037,45,I can't wait to see Melenchon lose the election and get a healthy TL. You guys are truly unbearable.,Tellement hâte de voir melenchon perdre les élections sur je récupère une TL saine. Vous êtes vraiment insupportables.,None,Mélenchon,None,NO,NO,NO,NO,NO,YES,NO,NO,NO
4423423,46,"2022 presidential election results: three maps to visualize the municipalities where Macron, Le Pen and Mélenchon came out on top in the first round via","Résultats présidentielle 2022 : trois cartes pour visualiser les communes où Macron, Le Pen et Mélenchon sont arrivés en tête au premier tour  via ",None,None,None,NO,NO,NO,NO,NO,NO,NO,NO,NO
5269853,47,"Well yes, clown since France does not publish statistics of this type",bah oui guignolo puisque la France publie pas de stats de ce type,None,None,None,NO,NO,NO,NO,NO,NO,NO,NO,NO
1251138,48,"Well, I hope she does, and hopefully it's without you. Call for a direct vote for Macron; it will be simpler and more courageous. For the definition of courage, refer to the Larousse dictionary.","Eh ben j'espère qu'elle en fera et stt que ce soit sans vous. Appelez à voter Macron direct ce sera plus simple et plus courageux. Pour la définition du courage, se référer au Larousse..",None,None,Macron,NO,NO,NO,NO,NO,NO,YES,NO,NO
3793310,49,Or for a hyaluronic acid treatment!,Ou pour un soin à l'acide hyaluronique !,None,None,None,NO,NO,NO,NO,NO,NO,NO,NO,NO
3916482,50,"Because Macron has already been to Dakhla, in the Moroccan Western Sahara region, and he knows very well what's going on there. And the people we bombed are mercenaries, and it serves them right. And we'll do it again as long as people return to this area.","Parce que Macron a déja été à Dakhla, dans la région du Sahara occidental marocain, et qu'il sait très bien ce qu'il se passe la-bas. Et les gens qu'on a bombardés sont des mercennaires, et c'est bien fait pour eux. Et on recommencera tant que les gens rentrent dans cette zone.",None,None,Macron,NO,NO,NO,NO,NO,NO,YES,NO,NO
2736772,51,The French have already decided that he was eliminated for the third time in the first round. The people do not want this stage-drummer. Accept this verdict or leave politics.,Les Français ont déjà tranché  a été éliminé pour la 3 ème fois des le 1er tour Le peuple ne veut pas de ce batteur d estrade Acceptez ce verdict ou bien quittez la politique,None,Mélenchon,None,NO,NO,NO,NO,NO,YES,NO,NO,NO
3819330,52,"Yes, that's it, we're dealing with a guy completely disconnected from reality.","Oui c'est ça, on est sur un mec complètement déconnecté de la réalité",None,None,None,NO,NO,NO,NO,NO,NO,NO,NO,NO
5355284,53,she is for Zemmour at the stake the witch,elle est pour zemmour  au bûcher la sorcière,None,None,None,NO,NO,NO,NO,NO,NO,NO,NO,NO
4638392,54,Seriously... seriously?,Sérieux... sérieusement ?,None,None,None,NO,NO,NO,NO,NO,NO,NO,NO,NO
4825871,55,You vote for Zemmour lol,Tu vote zemmour mdrrr,None,None,None,NO,NO,NO,NO,NO,NO,NO,NO,NO
1834636,56,"It should also be said that this Bigorgne is a regular and self-confessed cocaine addict, to better set the scene, and that he is an old friend of Macron (since Sc Po)...","Il faudrait aussi dire que ce Bigorgne est un cocaïnomane régulier et assumé, pour mieux planter le décor, et qu’il est un vieux pote de Macron (depuis Sc Po)…",None,None,None,NO,NO,NO,NO,NO,NO,NO,NO,NO
3960235,57,"Not necessarily, we'll see. Personally, I already know who will advance to the second round, but the rest is a mystery. But people could well block Macron too because they'll be afraid he'll be re-elected.","Pas forcément, on verra bien. Perso je sais déjà qui va passer au second tour mais pour le reste, mystère. Mais les gens pourraient bien faire barrage à Macron aussi parce qu'ils auront peur qu'il soit réélu",None,None,None,NO,NO,NO,NO,NO,NO,NO,NO,NO
3730799,58,"We're still not allowed to hunt in the yard and?? Not even a ""traditional"" glue trap? It's for a friend.","On n'a toujours pas le droit de faire la chasse à cour à   et  ?? Même pas un piège  ""traditionnel "" à la glue ? C'est pour un copain. ",None,None,None,NO,NO,NO,NO,NO,NO,NO,NO,NO
143207,59,"5 years later, 1.5% is the new ""give or take 600,000""!","5 ans plus tard, 1,5% is the new ""à 600000 vois près""!",None,None,None,NO,NO,NO,NO,NO,NO,NO,NO,NO
2549782,60,Emmanuel McKinsey has done a lot of harm.,Le Emmanuel McKinsey a fait beaucoup de mal.,None,Macron,None,NO,NO,NO,YES,NO,NO,NO,NO,NO
5630455,61,"The more you insist, the more votes you lose!! and that makes us very happy, April 10, 8:01 p.m....we are very happy in Marseille! especially without seeing you! and without seeing Mélenchon! nor mlp... the final fight...in every sense of the word for you 3!","plus tu insistes, plus tu perds des votes!! et cela nous fait tres plaisir, 10 Avril 20 h 01...nous sommes tres bien a Marseille! surtout sans te voir! et sans voir Melenchon! ni mlp... la lutte finale...dans tous les sens du terme pour vous 3!",None,None,None,NO,NO,NO,NO,NO,NO,NO,NO,NO
682534,62,"That's because you always think it's only racists who vote for Le Pen. In reality, it's the poor and those who say their life is a ""shitty life."" Those who are really struggling. It's excellently summed up here, with graphs to support it:","C'est parce que vous pensez toujours que ce sont que des racistes qui votent Lepen. En réalité, ce sont les pauvres et ceux qui disent que leur vie est une ""vie de merde"". Ceux qui galèrent, vraiment. C'est excellemment bien résumé ici, graphes à l'appui : ",None,None,None,NO,NO,NO,NO,NO,NO,NO,NO,NO
566284,63,"Hello, Madam, French and Muslim by faith, millions of us are against Macron and were ready to give you our votes. The only problem is your stigmatization of Muslims and your ban on the veil in public spaces, but not the kippah. We will vote for Macron.",Bonjour Mme Français et musulman de confession nous sommes pour des millions anti Macron et etions prêt à vous donner nos voix le seul problème c'est votre stigmatisation des musulmans et votre interdiction du voile sur l'espace public mais pas la kippa. Nous voterons Macron,Macron,None,Macron,YES,NO,NO,NO,NO,NO,YES,NO,NO
5026073,64,How will you dress for Marine Le Pen's 2022 presidential election?,Vous allez vous habiller comment pour l'élection de Marine Le Pen à la presidentielles2022  ?,None,None,None,NO,NO,NO,NO,NO,NO,NO,NO,NO
1436975,65,"And Macron for 5 years only to end up not daring to come and defend his own, neither before the first round nor after. He prefers to harangue crowds of 3,000 people in a city like Marseille with wind. Ps. Where are we with the affair of the luxury car of Mr. Minister of Justice?",Et Macron 5 ans pour finir par ne pas oser venir défendre le sien ni avant le 1er tour ni après. Il préfère haranguer des foules  de 3000 personnes dans une ville comme Marseillle avec du vent. Ps. On en est ou avec l'affaire de la voiture de luxe de Mr le garde des Sceaux ?,None,None,None,NO,NO,NO,NO,NO,NO,NO,NO,NO
1152082,66,"Too bad Macron didn't want to have a debate, he would have destroyed it. That's why he didn't come, and he's running for a second term ""loool""","Dommage que Macron n'a pas voulu faire de débat, il l'aurait éclaté. C'est pour cela qu'il n'est pas venu, et ça brigue un 2eme mandat ""loool""",None,None,None,NO,NO,NO,NO,NO,NO,NO,NO,NO
504953,67,"Well yes, you are right to question yourself and so much the better. That's what most people should be doing instead of following like sheep.",Ben oui tu as raison de te questionner et tant mieux. C'est ce que devrais faire la plupart des gens au lieu de suivre comme des moutons.,None,None,None,NO,NO,NO,NO,NO,NO,NO,NO,NO
1908700,68,"He will appoint Jadot for 2 months until the legislative elections, if he is elected!!!","Il va nommer Jadot pour 2 mois jusqu’aux législatives, s’il est élu !!!",None,None,None,NO,NO,NO,NO,NO,NO,NO,NO,NO
3786538,69,Orban played the pacifism card to win the elections; Lepen is doing the same thing and could well win the elections thanks to the war in Ukraine: not our war.,Orban a joué la carte du pacifisme pour gagner les élections ; Lepen fait la même chose et pourrait bien gagner les élections grâce à la guerre en Ukraine : pas notre guerre.,None,None,None,NO,NO,NO,NO,NO,NO,NO,NO,NO
2203131,70,"I was answering your ""if""",Je répondais à ton « si »,None,None,None,NO,NO,NO,NO,NO,NO,NO,NO,NO
5497562,71,"The worst thing is that I saw people say ""but Le Pen isn't racist, eh"" 1st degree...","le pire c'est que j'ai vu des gens dire ""mais le pen est pas raciste hein"" 1er degrés...",None,Le Pen,None,NO,NO,NO,NO,YES,NO,NO,NO,NO
1550153,72,"And without his friend Mélenchon, phew!",Et sans son copain Mélenchon ouf,None,None,None,NO,NO,NO,NO,NO,NO,NO,NO,NO
347376,73,Stop whining...,Arretez de chialer…,None,None,None,NO,NO,NO,NO,NO,NO,NO,NO,NO
3154687,74,"Madam .... We must take into account the experience we have lived through ""A people who elect corrupt people, renegades, impostors, thieves and traitors are not victims! They are accomplices."" Political writings: by George Orwell","Madame ....  Il faut tenir compte de l'expérience que nous avons vécu ""Un peuple qui élit des corrompus, des renégats, des imposteurs, des voleurs et des traîtres  n'est pas victime ! Il est complice. "" Ecrits politiques  : de George Orwell",None,None,None,NO,NO,NO,NO,NO,NO,NO,NO,NO
2723550,75,Le Pen is a liar and a thief! She must return the stolen money to Europe!,Lepen est une menteuse et une voleuse! Elle doit rendre l'argent volé a l'europe!,None,Le Pen,None,NO,NO,NO,NO,YES,NO,NO,NO,NO
4309183,76,"What a mess, Le Pen is a disgrace to the right. Let's vote for Zemmour, the only one capable of uniting the right and winning!","Quelle fonte, Le Pen est une honte pour la droite. Votons Zemmour, le seul capable de réunir la droite et de gagner !",None,Le Pen,None,NO,NO,NO,NO,YES,NO,NO,NO,NO
