idx_all,idx,english,french,ALL VOTEINTENTION,ALL CRITICISM,ALL SUPPORT,MACRON VOTEINTENTION,LEPEN VOTEINTENTION,MELENCHON VOTEINTENTION,MACRON CRITICISM,LEPEN CRITICISM,MELENCHON CRITICISM,MACRON  SUPPORT,LEPEN SUPPORT,MELENCHON SUPPORT
5888625,134,"It doesn't seem that difficult for you to vote for Macron given how you defend him tooth and nail. Apparently you don't mind going back into the streets in the face of a liberticidal and profoundly fascist state, which you've already suffered for 5 years! So young and already so cowardly","ça n’a pas l’air si difficile que ça pour vous de voter Macron vu comment vous le défendez bec et ongle. A priori ça ne vous dérange pas non plus de retourner dans la rue face à un état liberticide et profondément fasciste, déjà subie 5 ans ! Si jeune et déjà si lâche",None,Macron,None,NO,NO,NO,YES,NO,NO,NO,NO,NO
2205792,135,"I know we're disappointed, I'm going to vote for Marine to counter Macron.",Je sais on est déçu je vais voter marine pour contrer Macron,Le Pen,Macron,LePen,NO,YES,NO,YES,NO,NO,NO,NO,NO
1226842,136,Hate. And I'll be in opposition to it. And a right-wing program led by people I hate and I'll be in opposition to them (Macron's statement on LGBT and schools...). So I'm making a choice I don't like. But it's a left-wing program.,Déteste. Et dont je serai dans l'opposition. Et un programme de droite porté par des gens que je déteste et dont je serai dans l'opposition (la sortie de Macron sur les LGBT et l'école... ). Donc je fais un choix que j'aime pas. Mais qui est un programme de gauche.,None,Macron,None,NO,NO,NO,YES,NO,NO,NO,NO,NO
1375121,137,"Visiting a pro-Macron town. Yeah, yeah, we half got kicked out of a restaurant. We must not look right.",En visite avec  dans une ville pro Macron. Ouin Ouin on s'est a moitié fait jeter d'un restaurant. On doit pas avoir la gueule qu'il faut,None,Macron,None,NO,NO,NO,YES,NO,NO,NO,NO,NO
3194066,138,"But I think you already did that in 2017, right? What changed? Did your vote help save democracy and tolerance? What do you demand from Macron in exchange for your vote?","Mais je crois que tu as déjà fait ça en 2017, non ? Qu’est-ce qui a changé ? Est-ce que ton vote a servi à sauver la démocratie et la tolérance ? Qu’est-ce que tu exiges de Macron en échange de ton vote ?",None,None,None,NO,NO,NO,NO,NO,NO,NO,NO,NO
2776899,139,"The unscrupulous leftists are putting Macron and Le Pen on a par. I'm already giggling in advance about what will happen to morally filthy people like you, if by chance the bell wins. And I'm pissing myself thinking about the mess you'll pull off later.","Les gauchiasses sans scrupules mettent à égalité Macron et Le Pen. Moi, je rigole d'avance sous cape à propos de ce qui va arriver à des moralement crasseux comme vous, si d'aventure c'est la cloche qui gagne. Et je me pisse dessus en pensant à la gu... que vous ferez, plus tard.",None,None,None,NO,NO,NO,NO,NO,NO,NO,NO,NO
296153,140,"So I'm laughing at everyone for the moment, inviting everyone to vote for Macron, from the Greens to Hidalgo, including Pecresse. Le Pen is going to struggle.",Alors là je me marre tous pour l'instant invite à voter Macron des écolos à Hidalgo en passant par Pecresse. Le Pen va ramer,None,None,None,NO,NO,NO,NO,NO,NO,NO,NO,NO
2795754,141,"The die is not cast, no! The Macron-Black Rock project may be tied up, but that doesn't mean it's going to happen, unless the French have truly become completely passive zombies.","Les jeux ne sont pas faits, non ! Le projet Macron-Black Rock est ficelé peut-être, mais ce n'est pas pour ça que ça va se réaliser, sauf vraiment à ce que les Français soient devenus des zombis complétement passifs.",None,Macron,None,NO,NO,NO,YES,NO,NO,NO,NO,NO
815825,142,"Tonight, I'm supporting him because he's the best candidate to beat the ex-right and Macron. I'm voting for him because he has the best, most comprehensive program for ecology and wealth sharing! MelenchonWillWinElysee2022","Ce soir, je soutiens  parce qu'il est le meilleur candidat pour battre l'ex-droite et Macron.  Je vote pour  car il a le meilleur programme, le plus complet, pour l'écologie et le partage des richesses ! MelenchonVaGagner Elysee2022",Mélenchon,None,Mélenchon,NO,NO,YES,NO,NO,NO,NO,NO,YES
5091095,143,"I think you're joking, vaccines lower immunity and side effects multiply. Vote Macron and you'll get your 6th dose, but still without me.","Vous plaisantez je pense, les vaccins baissent l'immunité et les effets secondaires se multiplient. Votez Macron vous aurez votre 6ème dose mais toujours sans moi.",None,Macron,None,NO,NO,NO,YES,NO,NO,NO,NO,NO
3187068,144,"But I'm glad she's staying at Fort Boyard, her colleagues should be happy for her! On that score, she could have been fired for saying I'm voting for Macron.","Mais encore heureux qu'elle reste dans fort boyard, ces collègues devraient etre content pour elle! A ce compte la elle aurait pu etre virée aussi pour dire je vote Macron",None,None,None,NO,NO,NO,NO,NO,NO,NO,NO,NO
2025106,145,I listened to your segment on RTLMatin and I congratulate you for the courage you had to talk about electoral fraud when no other candidate is talking about it and for having these two pro-Macron journalists try to destabilize you.,J'ai écouté votre passage sur RTLMatin  et je vous félicite pour le courage que vous avez eu de parler de fraudes électorales alors qu'aucun autre candidat n'en parle et le fait d'avoir ces 2 journalistes proMacron essayés de vous déstabiliser.,None,Macron,None,NO,NO,NO,YES,NO,NO,NO,NO,NO
884620,146,Choosing between Macron and Le Pen He would surely have lost but it would have consoled us... we would surely be less angry and the country would perhaps be less under pressure. The fault lies first and foremost with the media who played Macron's game,Choisir entre Macron et LePen  Il aurait sûrement perdu mais ça nous aurait consoler... on serait sûrement moins en colère et le pays serait peut être moins sous cocotte minute.  La faute en revient en tout premier lieu au média qui ont joué le jeu de Macron,None,Macron,None,NO,NO,NO,YES,NO,NO,NO,NO,NO
2244602,147,I'm surprised to receive dozens of tweets from Macron's team when I don't subscribe to any of these accounts!! Aren't we being forced?,Je suis étonné de recevoir des dizaines de tweet de l’équipe de Macron alors que je ne suis abonné à aucun de ces comptes !! On nous forcerait pas la main ?,None,Macron,None,NO,NO,NO,YES,NO,NO,NO,NO,NO
2964771,148,"Macron organized this duel. And now we have to follow his plan and build a roadblock that he'll then deny ever existed? France can burn, but I won't take part in this circus.","Macron a organisé ce duel.  Et maintenant on doit suivre son plan et faire un barrage dont il niera ensuite qu'il a existé ? La France peut bien brûler, je ne participerai pas à ce cirque.",None,Macron,None,NO,NO,NO,YES,NO,NO,NO,NO,NO
3395943,149,"My children, 16 and 19 years old, asked me to choose between the one who favors the rich and the one who hates black people. They told me that young people are against Macron, so they know what they know. For your information, my children are black. And I told them Macron. And there are the legislative elections.","Mes enfants, 16 et 19 ans m'ont demandé à choisir entre celui qui favorise les riches et celle qui hait les noirs. Me précisant que les jeunes sont contre Macron donc ce qu'ils connaissent. Pour info mes enfants dont noirs. Et je leur ai répondu Macron. Et il y a les législatives",Macron,Macron,Macron,YES,NO,NO,YES,NO,NO,YES,NO,NO
4272593,150,"As for the position of Prime Minister, it's nice to dream, he can always join forces with Le Pen. I'm tearing up my LFI card this evening and I'm going to join Mr. Roussel, who at least called on people to vote for Macron, to block Le Pen.","Quant au poste de premier Ministre c'est beau de rêver, il pourra toujours s'associer à LE PEN. Moi je déchire ma carte LFI dès ce soir et je vais rejoindre Mr ROUSSEL, qui lui a au moins appelé à voter Macron, pour faire barrage à LE PEN.",Macron,Mélenchon,None,YES,NO,NO,NO,NO,YES,NO,NO,NO
3796166,151,"Yeah, well, Sarkozy is only speaking out now that it's the second round and against Le Pen. If we play this game, Hidalgo, Roussel, Jadot and Mélenchon have also called for people to rally behind Macron.","Ouai fin Sarko se prononce uniquement mtn que c’est le second tour et face à Le Pen. Si on joue à ce jeu, Hidalgo, Roussel, Jadot et Melenchon ont aussi appellé à se rassembler derrière Macron. ",None,None,None,NO,NO,NO,NO,NO,NO,NO,NO,NO
2022359,152,"I voted for Macron without hesitation. Without hesitation because I don't want to see any more children getting vaccinated. If it hadn't been for the health or vaccination pass issue, I would have abstained.","J'ai voté dégage Macron sans hésiter. Sans hésiter car je ne veux plus voir d'enfants se faire vacciner. S'il n'y avait pas eu le problème du pass sanitaire ou vaccinal, je me serais abstenue.",None,Macron,Macron,NO,NO,NO,YES,NO,NO,YES,NO,NO
1080204,153,"Anyway, I don't intend to vote for Le Pen, nor Macron, history... It was a different era, I don't think the FN could ever be in power. The French are not idiots, have a nice day.","De toute manière je n'ai pas l'intention de voter Lepen, ni Macron, l'histoire.... C'était une autre époque, je ne pense pas que le FN puisse être au pouvoir un jour. Les français ne sont pas des idiots, bonne journée.. ",None,None,None,NO,NO,NO,NO,NO,NO,NO,NO,NO
457119,154,"Well, Macron neither! I plan to abstain, personally I won't vote for him.",Bah Macron non plus ! Je compte m’abstenir perso je voterai pas pour lui,None,None,None,NO,NO,NO,NO,NO,NO,NO,NO,NO
1833761,155,You will have to explain to your journalist that McKinsey and Rothschild are two different things: Macron is accused of having put his income in tax havens when he worked at the Rothschild bank. Your columnist should work on his subject a little more.,Il faudra expliquer à votre journaliste que Mc Kinsey et Rotschild sont 2 choses diff : Macron est accusé d'avoir mis ses revenus dans des paradis fiscaux quand il travaillait à la banque Rotschild . Il faudrait q votre chroniqueur travaille un peu plus son sujet,None,None,None,NO,NO,NO,NO,NO,NO,NO,NO,NO
1706158,156,"Giscard had big industrial projects, nuclear etc. what about Macron who closed Fessenheim?","Giscard avait de grand projets industriels, nucléaire etc quid de Macron qui a fermé Fessenheim ?",None,Macron,None,NO,NO,NO,YES,NO,NO,NO,NO,NO
1544686,157,"And when I say Le Pen and Macron, but before I could unfold my promo you and Kamil in particular were invective and contemptuous while I was calling for unity there, but you understood it even if I was not allowed to unfold my thoughts.","Et quand je dis Lepen et Macron, mais avant que je puisse dérouler mon promos vous et Kamil particulièrement a été invectivant et méprisant alors que j'appelais à la bas à l'union, mais tu l'as compris même si on m'a pas laissée dérouler ma pensée.",None,None,None,NO,NO,NO,NO,NO,NO,NO,NO,NO
5868815,158,"Eric, are you all bound by time parity between candidates? Media, TV, Press? Have you been refused? Macron in an interview, possessed by his usual courage,... No, I'm kidding... You can use your joker and/or respond later...","Éric  êtes vs tenus par la parité de temps entre candidat ?  Com médias TV Presse  ?  Avez vous essuyé des refus ?   Macron en Itw, habité par son courage habituel,... Nan je déconne...   Vous pouvez user de votre joker et / ou répondre plus tard...",None,None,None,NO,NO,NO,NO,NO,NO,NO,NO,NO
4079539,159,"In this case, what he says is obvious or false. Young people obviously vote more to the left. But it was not the older ones who voted for Le Pen in the majority (41% for Macron for those aged 65+). Those who voted for Le Pen in the majority were the intermediate ages 35-65.","Pour le coup ce qui l dit est évident ou faux La jeunesse vote évidemment plus à gauche Mais ce ne sont pas les plus âgés qui ont majoritairement voté le Pen (41% pour Macron pour les 65+) Ceux qui ont majoritairement voté le Pen, ce sont les âges intermédiaires 35-65",None,None,None,NO,NO,NO,NO,NO,NO,NO,NO,NO
2139532,160,"I don't believe anything, I simply note that Macron does the same but benefits from a totem of immunity because he is on the right side of your chessboard... You can be anti-FN but you don't need to adorn the other candidate with imaginary virtues even if it reassures you!","Je ne crois rien, je constate simplement que Macron fait pareil mais bénéficie d un totem d immunité parce qu il est du bon côté de votre échiquier…  Vous pouvez être anti FN mais vous avez pas besoin de parer de vertus imaginaires l autre candidat même si ça vous rassure !",None,None,None,NO,NO,NO,NO,NO,NO,NO,NO,NO
97177,161,"I've been crying with laughter for 10 minutes. I asked my mother for her prediction for tonight. What did she say? ""Uh, I'd say Macron against uh, Taubira.""",10 minutes que je pleure de rire j’ai demandé à ma mère son pronostic pour ce soir elle m’a dit quoi?? « Euh moi je dirais Macron contre euh Taubira »,None,None,None,NO,NO,NO,NO,NO,NO,NO,NO,NO
4433777,162,IF LE PEN GETS UP WITH ZEMMOUR I WILL NOT VOTE <for her ZEMMOUR TOO TOO NEGATIVE ABOUT EVERYTHING WITH HIM WE HAVE NO LONGER TO DO BUT COMMIT SUICIDE; Presidential: Macron's unnoticed statement on euthanasia via,SI LE PEN SE MET AVEC ZEMMOUR je ne voterai PAS <pour elle ZEMMOUR TROP TROP NEGATIF  SUR TOUT AVEC LUI ON N A PLUS QU A SE SUICIDER; Présidentielle : la déclaration passée inaperçue de Macron sur l'euthanasie  via,None,None,None,NO,NO,NO,NO,NO,NO,NO,NO,NO
4340920,163,"If we're going to get Macron back on track, I suggest we move from a five-year term to weekly presidential elections. I've noticed that he's very attentive a week before an election.","Quitte à se retaper Macron, je propose de passer du quinquennat  aux présidentielles hebdomadaires.  J'ai remarqué qu'il était très à l'écoute à une semaine d'une élection.",None,Macron,None,NO,NO,NO,YES,NO,NO,NO,NO,NO
571845,164,"Hello, could you tell me why you blocked my main account? I am a fervent supporter of Emmanuel Macron.","Bonjour, possible de savoir pourquoi vous avez bloqué mon compte principale  ? Alors que justement je suis un fervent défenseur d'Emmanuel Macron ",None,None,Macron,NO,NO,NO,NO,NO,NO,YES,NO,NO
4610938,165,"I agree your strategy is sound, but to vote for her, let alone affirm it, I can't. Let them sort it out for themselves. The fascists were already in heaven with Macron, I can't imagine with her. Not to mention that there are a lot of tricks to get her to really screw things up.",Suis d'accord votre stratégie se tiens mais de là a voter pour elle et plus encore de l'affirmer je peux pas. Qu'iels se demerdent. Les fafs étaient déjà aux anges avec Macron je n'ose imaginer avec elle. Sans compter que y'a pas mal d'entourloupe pour elle bien foutre la merde.,None,Le Pen,None,NO,NO,NO,NO,YES,NO,NO,NO,NO
4543363,166,"If we understand the logic: I want to beat the far right by voting for Macron in the second round... Personally, I prefer to beat them in the first round and not have to vote for Macron.",Si on comprend la logique : je veux battre l'extrême droite en votant Macron au second tour... Personnellement je préfère la battre au premier tour et ne pas avoir à voter Macron,None,Macron,None,NO,NO,NO,YES,NO,NO,NO,NO,NO
4671559,167,"Taubira makes a choice like a myriad of people on the left, including socialists. Voting for Mélenchon = possible failure of MLP but it is ensuring the re-election of Macron because JLM will be crushed in T2. ​​This choice is surprising. I vote for my candidate in T1 and I block T2.","Taubira fait un choix comme une myriade de gens de gauche, y compris socialistes Voter Mélenchon = possible échec de MLP mais c'est assurer la réélection de Macron car JLM sera écrasé au T 2 Surprenant ce choix. Moi, je vote pour ma candidateau T 1 et je fais barrage au T 2",None,Macron,None,NO,NO,NO,YES,NO,NO,NO,NO,NO
4006216,168,"Personally, I'll vote blank! It's clear that Macron will come back in force with his syringe!",Perso je voterai blanc! Il est clair que Macron va revenir en force avec sa seringue!,None,Macron,None,NO,NO,NO,YES,NO,NO,NO,NO,NO
1137699,169,"Tell yourself, my friend, that I, as a Muslim, would vote for Marine just to see your protégé Macron go to hell.... She won't do any worse than him.","Dis toi bien l'ami , que je moi musulman je voterais marine juste pour voir ton poulain Macron se casser .... Elle feras pas pire que lui",Le Pen,None,LePen,NO,YES,NO,NO,NO,NO,NO,NO,NO
3424448,170,I voted for Marine Le Pen and I know that those around me voted for Macron.,Moi j'ai votée MarineLePen et je sais que mon entourage à voter Macron,Le Pen,None,LePen,NO,YES,NO,NO,NO,NO,NO,NO,NO
1693795,171,Smoking I don't know but the finger that furtively comes to rub the nose of Macron of my regular mother looks exactly like the gesture of the cocaine user... . The powdered one what,Fumer je ne sais pas mais le doigt qui vient furtivement frotter le nez de Macron de ma mère régulière ressemble tout a fait au geste de l'usager de la cocaïne... . Le poudré quoi,None,Macron,None,NO,NO,NO,YES,NO,NO,NO,NO,NO
2613031,172,"Fascism doesn't protect, it destroys! Not a single vote for LP. The problem is that Macron also destroys! Just take stock! Since he claims that there is no such thing as a Republican vote and that people only vote for his project, let him go get his votes!","Le fascisme ne protège pas, il détruit ! Pas une voix pour LP. Le problème est que Macron aussi détruit ! Il suffit de dresser son bilan ! Puisqu'il prétend qu'il n'existe pas de vote républicain et que les gens votent uniquement pour  son projet, qu'il aille chercher ses voix !",None,Le Pen,None,NO,NO,NO,NO,YES,NO,NO,NO,NO
2542172,173,"On April 10, I voluntarily voted for a 5% cdt with a clear objective of guaranteeing a 2nd round Macron vs LePen. I can now vote Macron while maintaining my ""left"" facade because now I am obliged, you understand? It was IMPOSSIBLE to have other choices","Le 10 avril, j'ai voté volontairement pour un cdt à 5% avec un objectif clair visant à garantir un 2nd tour Macron vs LePen. Je peux maintenant voter Macron en conservant ma façade ""de gauche"" car là je suis obligée tu comprends ? C'était IMPOSSIBLE d'avoir d'autres choix",Macron,None,None,YES,NO,NO,NO,NO,NO,NO,NO,NO
1969190,174,"Imagine being in Le Pen's shoes, getting screwed like Abella Danger, on the subject of purchasing power by the president who screwed us on purchasing power Xptdr lol jpp nah but uh uh imagine JeVoteMacron NiMarineNiLePen pouvoirdachat DebatMacronLePen","Imaginez être à la place de Le Pen, se faire baiser comme Abella Danger, sur le sujet du pouvoir d'achat par le président qui nous a baisé sur le pouvoir d'achat  Xptdr lol jpp  nah mais euh euh imaginez JeVoteMacron NiMarineNiLePen pouvoirdachat DebatMacronLePen",Macron,Le Pen,None,YES,NO,NO,NO,YES,NO,NO,NO,NO
462740,175,"Well, between Macron and Le Pen, I don't hesitate for a second. And Mélenchon is just not possible. A president who prefers criminals to cops? With whom we will live without electricity but with mosques everywhere? No.","Bah entre Macron et le Pen, je n'hésite pas une seconde. Et Mélenchon c'est juste pas possible. Un président qui préfère les délinquants aux flics ? Avec qui on vivra sans électricité mais avec des mosquées partout ? Non",None,Mélenchon,None,NO,NO,NO,NO,NO,YES,NO,NO,NO
2418530,176,"Macron's France is a continuous chaos, which objectively a very large majority of French people have noticed (and that's excluding COVID, even before). Get out of your bobo city, no kidding, it's incredible to say so much nonsense...","La France de Macron c'est un chaos continu, qu'objectivement une très grande majorité des Français ont constatés (et ça en excluant le COVID, même avant). Sortez de votre bobo city sans déconner c'est incroyable de dire autant de conneries...",None,Macron,None,NO,NO,NO,YES,NO,NO,NO,NO,NO
2277761,177,"I will vote AGAINST Macron, out of respect and in support of the professionals suspended and martyred for refusing to vaccinate. This is one of the many reasons why I will sit on certain personal principles, but anything but this sick and toxic bastard.","Je voterai CONTRE Macron, par respect et en soutien des professionnels suspendus et martyrisés pour refus de vax.  C’est une des multiples raisons qui font que je vais m’asseoir sur certains principes personnels, mais tout sauf ce foutriquet malade et toxique.",None,Macron,None,NO,NO,NO,YES,NO,NO,NO,NO,NO
3876724,178,"Yes, yes, I agree with that, obviously. Besides, LFI is the movement that received the most abstentionist votes. But some will vote against Macron because they have seen the effects of his policies in their own flesh.","Oui, oui je suis d'accord avec ça évidemment. D'ailleurs LFI est le mvt qui a recup le plus de voix d'abstentionnistes. Mais certains iront voter face à Macron car on pu constater dans leur chair les effets de sa politique.",None,None,None,NO,NO,NO,NO,NO,NO,NO,NO,NO
501091,179,"Well, I still note that a bank lent a young person the equivalent of the price of a Parisian apartment when his parents wouldn't have helped him? The banks were already nice to Macron. This guy never stops lying.",Ben moi je note quand même qu’une banque à prêté à un jeune l’équivalent du prix d’un appartement parisien alors que ses parents ne l’auraient pas aidé ? Elles étaient déjà sympa les banques avec Macron. Il ne s’arrête jamais de mentir ce type.,None,Macron,None,NO,NO,NO,YES,NO,NO,NO,NO,NO
1145393,180,Keep in mind that no one will get out of this if Macron is re-elected. What's happening in Shanghai will happen soon. Few people are aware of it because vacation plans mustn't be disrupted.,Dites vous bien que personne n'en sortira si Macron est réélu. Ce qui se passe à Shangaï va bientôt arrivé. Peu de gens en ont conscience parce que faut pas perturber les projets vacances.,None,Macron,None,NO,NO,NO,YES,NO,NO,NO,NO,NO
2129579,181,"I have no particular sympathy for Marine Le Pen. But she's right about this. In fact, she's far from the truth. Emmanuel Macron will kill France. That's his goal.",Je n'ai pas de sympathie particulière pour Marine Le Pen. Mais elle a raison sur ce point. Elle est même loin de la vérité.  Emmanuel Macron tuera la France. C'est son objectif.,None,Macron,None,NO,NO,NO,YES,NO,NO,NO,NO,NO
1487057,182,"And exposed to these facts I don't understand how one can still say to oneself ""ah yes, that represents me, such and such a right-wing candidate (Macron, Zemmour, Lepen) will improve my living conditions""... Even if one is selfish, aiming for anything but the right is better for oneself.","Et exposé à ces faits je comprends pas qu'on puisse quand même se dire ""ah oui, ça, ça me représente, tel candidat de droite (Macron, Zemmour, Lepen) va améliorer mes conditions de vie""... Même en étant égoïste, viser tout sauf la droite c'est mieux pour soi.",None,None,None,NO,NO,NO,NO,NO,NO,NO,NO,NO
2481568,183,"The chosen marketing communication trend, a new form of cowardice, Macron-style: obviously, it's easier! No interviews, no debate, we're showing you a cute little film. Especially compared to Zemmour, who is very comfortable because he's driven by stable convictions.","La mode de la communication marketing choisie, nouvelle lâcheté à la sauce Macron : évidemment, c'est + facile ! Pas d'itw, pas de débat, on vous projette un petit film bien coquet. Surtout comparé à Zemmour, très à l'aise car porté par des convictions stables.",None,Macron,None,NO,NO,NO,YES,NO,NO,NO,NO,NO
1994275,184,"I forgot...I'm going to close my business...they'll go to hell...anyway, they voted for Meluche. So no compensation, they'll just have to ask Macron.","J oubliais...je vais fermer mon entreprise...ils iront se faire voir...de toutes façons, ils ont voté Meluche. Donc pas d indemnités   ils n aurobt qu à demander à Macron.",None,None,None,NO,NO,NO,NO,NO,NO,NO,NO,NO
3580737,185,"No, I'm talking about income. It's from 3,000 euros that Macron starts to get exceptional voting figures. In my town, the richest neighborhood put 44 Macrons, 10 Zemmour and 8 Pécresse.",Non je parle des revenus c'est à partir de 3000 euros que Macron commence à obtenir des chiffres de votes exceptionnelle dans ma commune le quartier le plus riches a mis 44 Macron 10 Zemmour  et8 Pécresse,None,None,None,NO,NO,NO,NO,NO,NO,NO,NO,NO
,186,"Z made a fool of himself, I'm very happy (we're off for another 5 years of Macron, what a disaster again)",Le Z s’est ridiculisé je suis très content ( on repart pour 5 ans de Macron quelle catastrophe encore ),None,Macron,None,NO,NO,NO,YES,NO,NO,NO,NO,NO
1134464,187,"To say that it's Macron against fascism is ironic when we know that this president shot protesters (young or old, women or men), brought high school students to their knees, sidelined healthcare workers, sidelined non-vaxxers, and pointed the finger at all these people.","Dire que c'est Macron contre le fascisme, c'est ironique quand on sait que ce président a tiré sur des manifestants ( jeune ou vieux, femme ou homme), mit à genoux des lycéens, mit au placard des soignants, mit à l'écart des non vax, pointé du doigt tout ce petit monde.",None,Macron,None,NO,NO,NO,YES,NO,NO,NO,NO,NO
