idx_all,idx,english,french,ALL VOTEINTENTION,ALL CRITICISM,ALL SUPPORT,MACRON VOTEINTENTION,LEPEN VOTEINTENTION,MELENCHON VOTEINTENTION,MACRON CRITICISM,LEPEN CRITICISM,MELENCHON CRITICISM,MACRON  SUPPORT,LEPEN SUPPORT,MELENCHON SUPPORT
909859,188,"Like freedom of speech because Le Pen is undermining democracy and then we will have nothing but our eyes to cry about, so stop believing in Le Pen, you (young people) who say that ""Macron Le Pen is the same"" reread the history books and dictionary for the word dictatorship","Comme la liberté de parole car le Pen met à mal la démocratie et la on aura plus que nos yeux pour pleurer donc arrêter de croire en le Pen vous (les jeunes) qui dites que que ""Macron le Pen c'est pareille"" relisez les livres d'histoires et dictionnaire pour le mot dictature",None,Le Pen,None,NO,NO,NO,NO,YES,NO,NO,NO,NO
5837767,189,"We understand that. Vote for Macron already and in the legislative elections and I'm asking to see because Merluche is constantly changing his tune. Do what I say but not what I do, that's his motto. For ecology but take the plane to the other side of the world non-stop in business class of course.",Ça on a bien compris. Votez deja Macron et aux législatives et je demande à voir car Merluche retourne sa veste sans cesse. Faites ce que je dis mais pas ce que je fais c’est sa devise. Pour l’écologie mais prend l’avion à l’autre bout du monde sans arrêt  en business bien sûr,None,Mélenchon,None,NO,NO,NO,NO,NO,YES,NO,NO,NO
5099955,190,You know what I think? He started the war when he went to see Putin. His visit took place a few days before Putin finally made a move. What did Macron say to him from the end of that long table? What message from NATO?,Vous savez ce que je pense ? C'est qu'il a déclenché la guerre quand il est allé voir Poutine. Sa visite s'est passée quelques jours avant que Poutine ne finisse par bouger. Que lui a dit Macron du bout de cette longue table ? Quel message de l'OTAN ?,None,None,None,NO,NO,NO,NO,NO,NO,NO,NO,NO
1321254,191,"In 2017, for the second round, I tried to convince all my friends to vote for Macron, and I didn't vote for Macron (I didn't vote for Le Pen either). In 2022, I encourage all my friends to vote for Macron, and I will vote for Macron.","En 2017, pour le second tour, j'ai essayé de convaincre tout mes amis à voter Macron, et je n'ai pas voté Macron (je n'ai pas voté Le Pen non plus). En 2022, j'encourage tous mes amis à voter Macron, et je voterai Macron.",Macron,None,Macron,YES,NO,NO,NO,NO,NO,YES,NO,NO
1427685,192,"Does Macron's plan include the discount? Macronie says (timidly) that it's 43 years of contributions. Fine, but if I started at 18, and have therefore done my time, I should therefore stop at 61...but I'll take a discount...Interesting...","Est-ce que le projet de Macron intègre la décote? La Macronie dit (timidement) que c'est 43 annuités. Soit, mais si j'ai commencé à 18 ans, et que j'ai donc fait mon temps, je devrais donc m'arrêter à 61 ans...mais je vais me prendre une décote...Intéressant...",None,None,None,NO,NO,NO,NO,NO,NO,NO,NO,NO
4198843,193,"Presidential Election: ""I spend, therefore I am,"" attacks Valérie Pécresse, targeting Emmanuel Macron at a rally, during which Nicolas Sarkozy is booed. | Les Echos","Présidentielle : « je dépense donc je suis » attaque Valérie Pécresse en ciblant Emmanuel Macron en meeting, durant lequel Nicolas Sarkozy est sifflé.| Les Echos ",None,None,None,NO,NO,NO,NO,NO,NO,NO,NO,NO
3275983,194,Marine Le Pen wanted to refinish the facade but Macron revealed his plan,Marine le Pen voulais ripoliner la façade mais Macron a DÉVOILÉ son projet,None,None,None,NO,NO,NO,NO,NO,NO,NO,NO,NO
4585529,195,"Either you're doing it on purpose or you didn't understand. In short: Macron is a traitor to France, since he sold France to the USA via McKinsey=Mckinseygate. And for the details, I invite you to read, reread.","Soit vous faites exprès soit vous n'avez pas compris. En résumé: Macron est un traître a la France, puisqu'il a vendu la France aux USA via McKinsey=Mckinseygate Et pour le détail, je vous invite à lire, relire ",None,Macron,None,NO,NO,NO,YES,NO,NO,NO,NO,NO
2033722,196,"I would have voted for Mélenchon if he had been the alternative to Macron, but I don't see Mélenchon's supporters voting for Le Pen.",J'aurais votée Mélenchon si il avait été l'alternative à Macron mais je ne vois pas les partisans de Mélenchon voter Le Pen.,None,None,None,NO,NO,NO,NO,NO,NO,NO,NO,NO
2554877,197,"The OnePlanetSummit of , still as effective. Its famous ""at the same time"" therefore ... presidential2022 EmmanuelMacron Presidential: Jean Castex went to vote by private jet via","Le OnePlanetSummit de  , toujours aussi efficace. Son fameux ""en même temps"" donc ... presidentielles2022 EmmanuelMacron  Présidentielle: Jean Castex est allé voter en jet privé  via ",None,Macron,None,NO,NO,NO,YES,NO,NO,NO,NO,NO
2792433,198,"The rebels want a republic based on the three fundamental values ​​of the French Republic, as well as a progressive and ecological social project. Everything that Macron and Le Pen do not represent. You can insult us all you want, we don't fight.","Les insoumis veulent une république fondée sur les trois valeurs fondamentales de la république française, ainsi qu'un projet de société progressiste et écologiste. Tout ce que Macron et Le Pen ne représentent pas. Vous pouvez nous invectiver tant que vous voulez, on s'en bat.",None,None,Mélenchon,NO,NO,NO,NO,NO,NO,NO,NO,YES
2795065,199,Are the young people who voted for Macron okay?,Les jeunes qui ont voté Macron ça va?,None,None,None,NO,NO,NO,NO,NO,NO,NO,NO,NO
908777,200,"As I've already stated here, Mélenchon is running a successful campaign (less so than Roussel, however). My criticisms remain valid, and I remain and will remain very critical of him. Nevertheless, and without much pleasure, I must vote for Mélenchon to save the left.","Comme je l'ai déjà affirmé ici, Mélenchon mène une campagne réussie (moins que Roussel cependant). Mes critiques restent valides, et je reste et resterai très critique envers lui. Néanmoins, et sans grand plaisir, je me dois de voter Mélenchon pour sauver la gauche.",Mélenchon,None,Mélenchon,NO,NO,YES,NO,NO,NO,NO,NO,YES
1160732,201,So tomorrow I'm going to vote for Emmanuel Macron. Why have Pécresse on the right or Hidalgo on the left? The reasons must escape me. The responsibility for seeing Le Pen or Mélenchon in the second round comes from these choices. And it's catastrophic. In 5 years the situation will have changed.,Donc demain je vais voter Emmanuel Macron. Pourquoi avoir Pécresse à droite ou Hidalgo à gauche ?  les raisons doivent m'échapper. La responsabilité de voir Le pen ou Mélenchon au deuxième tour vient de ces choix. Et c'est catastrophique. Dans 5 ans la donne aura changé.,Macron,None,Macron,YES,NO,NO,NO,NO,NO,YES,NO,NO
2014614,202,"I looked at the results by department/region. In the end, it's only around Paris that you have a lot of Mélenchon, and otherwise I'm very surprised to see the Zemmour/Le Pen ratio.",J'ai regardé les résultats par département/région. Au final c'est qu'autour de Paris que tu as beaucoup Mélenchon et sinon je suis très étonné de voir le taux Zemmour / le pen,None,None,None,NO,NO,NO,NO,NO,NO,NO,NO,NO
2249719,203,"I treat those who deserve it... Lepen, sorry but I have a hard time... Mélenchon, let's not talk about it... As I said, a step back is necessary.","Je traite ceux qui le méritent... Lepen désolé mais j'ai du mal...  Mélenchon n'en parlons pas... Comme je l'ai dit, recul nécessaire.",None,Le Pen,None,NO,NO,NO,NO,YES,NO,NO,NO,NO
1164843,204,So the key for both candidates is abstention and Mélenchon. It's going to be a balancing act for both of them.,Donc la clé pour les deux candidats c'est abstention & Mélenchon. Difficile pour les deux ça va être un jeu d'équilibrisme,None,None,None,NO,NO,NO,NO,NO,NO,NO,NO,NO
2686901,205,"We know the role of LREM and Rhaine. That of the media too. Then, many played the game of voting effectively for Mélenchon... but not enough. Hence this second round.","Le rôle de LREM et du Rhaine on le connaît. Celui des médias aussi. Ensuite, beaucoup ont joué le jeu du vote utile en direction de Mélenchon... mais pas assez. D'où ce 2e tour",None,None,None,NO,NO,NO,NO,NO,NO,NO,NO,NO
1577434,206,And you really think that Mélenchon's voters will vote for MLP... I believe that we are heading towards an unprecedented number of abstentions,Et vous pensez réellement que les électeurs de Mélenchon vont voter pour MLP... je crois que nous allons vers un nombre d'abstention jamais égalé,None,None,None,NO,NO,NO,NO,NO,NO,NO,NO,NO
3491818,207,"For me, Mélenchon is out of the question; he is surrounded by anti-Semites. I have no desire for him to be in the second round.",Mélenchon pour moi c'est hors de question il est entouré d'antisémites .je n'ai aucune envie qu'il soit au deuxième tour.,None,Mélenchon,None,NO,NO,NO,NO,NO,YES,NO,NO,NO
2015424,208,"I received it. But no voter registration card. No problem, I remind Mélenchon's voters that all they need is an ID card to vote. A voter registration card is not mandatory. For those who vote for MLP or Macron, however, it is mandatory.","J'ai reçu. Mais pas de carte d'électeur. Pas grave, je rappelle aux électeurs de Mélenchon qu'il suffit d'une pièce d'identité pour voter. Carte d'électeur pas obligatoire. Pour ceux qui votent MLP ou Macron, par contre, elle est obligatoire. ",None,None,None,NO,NO,NO,NO,NO,NO,NO,NO,NO
23669,209,"""Young people will tell me we haven't got there yet. So I say to you: do better, thank you!"" Jean-luc D.Mélenchon 1st Round Melenchon","""Les jeunes me diront on n'y est pas encore arrivé. Alors je vous dis : faites mieux, merci !"" Jean-lucD.Mélenchon  1erTour Melenchon ",Mélenchon,None,Mélenchon,NO,NO,YES,NO,NO,NO,NO,NO,YES
125907,210,"2nd Round Given Mélenchon's result in the Overseas Territories and in certain departments, given the small difference between him and Le Pen, given the rejection of responsibility on the left, given the Sorbonne, a small three-way race in keeping with the 1st Round?","2emeTour Vu le résultat de Mélenchon dans les Outremer et dans certains départements, vu la faible différence entre lui et LePen, vu les rejets de responsabilité à gauche, vu La Sorbonne, une petite triangulaire dans le respect du 1erTour ?",None,None,None,NO,NO,NO,NO,NO,NO,NO,NO,NO
2021607,211,"I voted for Mélenchon. I will vote for MLP. If Z had been in the second round, I would have voted for Z. Anything but Macron, whatever the cost. (In 2017 I abstained) PS: I am pro-Frexit and ex-UPR.","J'ai voté Mélenchon. Je voterai MLP. Si Z avait été au 2nd tour, j'aurais voté Z. Tout sauf Macron, quoi qu'il en coûte. (En 2017 je m'étais abstenu) PS : je suis pro Frexit et ex UPR.",Le Pen,Macron,LePen,NO,YES,NO,YES,NO,NO,NO,NO,NO
4066610,212,"For these 2022 presidential elections, I will vote for Mélenchon so that he reaches the second round instead of the extreme right.",Pour ces presidentielles2022 je voterai Mélenchon pour qu'il accède au second tour en lieu et place de l'extrême droite.,Mélenchon,None,Mélenchon,NO,NO,YES,NO,NO,NO,NO,NO,YES
2003112,213,"I counted the ballots, from what I saw it's more Macron/Mélenchon, that's a spoiler.","J'ai dépouillé les bulletins, de ce que j'ai vu c'est plus Macron/Mélenchon voilà je spoil",None,None,None,NO,NO,NO,NO,NO,NO,NO,NO,NO
390486,214,"My bad, I confused the YPG (which Macron supports) with the PKK (which he claims to fight). I am the first to hate Mélenchon's foreign policy and I understand that he can be criticized (...)","Au temps pour moi, j'ai fais la confusion entre YPG (que Macron soutien) et PKK (qu'il prétend combattre). Je suis le 1er à détester la politique étrangère de Mélenchon et je comprends qu'on puisse lui reprocher (...)",None,Mélenchon,None,NO,NO,NO,NO,NO,YES,NO,NO,NO
3638952,215,"We are counting on you, my friends at Mélenchon. We all want the good of our France and our children. The time has come to vote. The hardest part is getting us young people to come together behind Marine.","Nous comptons sur vous mes amis chez Mélenchon, nous voulons tous le bien de notre France, de nos enfants, l'heure est venue de voter , le plus dure reste a faire rassembler nous les jeunes derrières Marine",Le Pen,None,LePen,NO,YES,NO,NO,NO,NO,NO,NO,NO
5836260,216,"There's no point in responding to trolls on Twitter. We're in a democracy, everyone votes for whoever they want. Yeah, it pisses me off to see a Macron-Le Pen second round, I would have preferred to see Mélenchon. But in the first round, I prefer to vote for the candidate who suits me (EELV)","Ça ne sert à rien de répondre aux trolls sur Twitter. On est en démocratie, chacun vote pour qui il veut. Ouais, ça me saoule de voir un second tour Macron-Le Pen, j'aurais préféré voir Mélenchon. Mais au premier tour, je préfère voté pour le candidat qui me correspond (EELV)",None,None,None,NO,NO,NO,NO,NO,NO,NO,NO,NO
2085662,217,"I completely understand those who voted for Mélenchon, even if personally it was no longer possible for me. Now that the collective defeat is confirmed, we must all have our eyes fixed on the legislative elections with a common goal: unite or see the left die.","Je comprends parfaitement ceux qui ont voté Mélenchon, même si personnellement ce n'était plus possible pour moi.  Maintenant que la défaite collective est entérinée, on doit tous avoir les yeux rivés sur les législatives avec un objectif commun: s'unir ou voir la gauche mourir.",None,None,None,NO,NO,NO,NO,NO,NO,NO,NO,NO
1127756,218,"Sunday, clearly on my way to vote, I will think about all these years of struggle with Macron, all his broken promises, and above all I will think that with Mélenchon I will be able to live decently with an increase in the minimum wage SundayIVoteMelenchon",Dimanche moi clairement sur le chemin pour aller voter je vais penser à toutes ces années de galère avec Macron toutes ses promesses non tenues et je vais surtout penser qu’avec Mélenchon je vais pouvoir vivre décemment avec une augmentation du smic DimancheJeVoteMelenchon,Mélenchon,Macron,Mélenchon,NO,NO,YES,YES,NO,NO,NO,NO,YES
784731,219,"It's not very funny, but I want to point out that if the case of the Jew under the tram starts to make the news, Mélenchon will have been right about the incident a week before the presidential election.","Ce n'est pas très drôle mais je tiens à faire remarquer que si l'affaire du juif sous le tramway commence à faire l'actualité, Mélenchon aura bien eu raison sur l'incident à une semaine de la présidentielle.",None,Mélenchon,None,NO,NO,NO,NO,NO,YES,NO,NO,NO
4557097,220,"If you want a 2) don't hesitate, I could tell you about Mr. Mélenchon's deafness, which allowed Macron, through this reflection, to discredit two of his competitors in the presidential election... classy.","Si tu veux un 2) n’hésite pas, je pourrait te parler de la surdité de mr Mélenchon, qui a permis à Macron par cette réflexion de discréditer 2 de ses concurrents à la présidentielle… classe.",None,Mélenchon,None,NO,NO,NO,NO,NO,YES,NO,NO,NO
2287139,221,I swear I woke up hoping that in the early morning I'd find out that Mélenchon had passed. And so I'm still frustrated despite the night.,"Je vous juuuure que je le suis réveillé dans l'espoir qu'au petit matin, j'apprends que Mélenchon est passé . Et du coup, je suis toujours frustré malgré la nuit ",None,None,None,NO,NO,NO,NO,NO,NO,NO,NO,NO
3479652,222,"Mélenchon: diversity without touching! And if you touch me I'll move away with haste, disgust and contempt.","Mélenchon : la mixité sans se toucher !  Et si tu me touches je me dégage avec hâte, dégout et mépris ..",None,Mélenchon,None,NO,NO,NO,NO,NO,YES,NO,NO,NO
3484779,223,"Mélenchon as heir, a guy who, in third place, feels more legitimate than the first two, having taken over the whole of the left through a game of blackmailing pressure on the ""useful vote"", claiming that all these votes are a plebiscite, not bad...","Mélenchon en héritier, un type qui, troisième, se sent plus légitime que les deux premiers, en ayant fait main basse sur l'ensemble de la gauche par un jeu de pression chantage au ""vote utile"", affirmant que tous ces votes sont un plébiscite, pas mal...",None,Mélenchon,None,NO,NO,NO,NO,NO,YES,NO,NO,NO
3450613,224,"My son tells me he supports Philippe Poutou, my ex (his mother) voted for Mélenchon, the last one left me when I told her I was R! My best friends don't talk to me anymore because they campaign for LO or in indigenous associations. You guys are so lucky","Mon fils me dit soutenir Philippe Poutou, mon ex (sa mère) a voté Mélenchon, la dernière m'a quitté quand je luis ai dit que j'étais R! Mes meilleurs amis ne me parlent plus parce qu'ils militent pour LO ou dans des asso indigénistes. Vous avez bien se la chance vous autres ",None,None,None,NO,NO,NO,NO,NO,NO,NO,NO,NO
650479,225,"The mentality of the French is crazy, I voted for Mélenchon and yet I'm not Islamic, eh!! Shitty thoughts for a shitty fascist, go back and vote for Zemmour and don't come and bother us","C'est dingue la mentalité des français, j'ai voté Mélenchon et pourtant je suis pas islamique hein !!  Réflexion de merde pour un facho de merde retourne voté Zemmour et viens pas nous faire chier",Mélenchon,None,None,NO,NO,YES,NO,NO,NO,NO,NO,NO
4357867,226,"Turbocon reasoning, there are reasons not to vote for Mélenchon, that's what I'm going to do elsewhere, but claiming that it's better that Le Pen is in the second round is really a load of crap.","Raisonnement turbocon, y a des raisons de pas voter Mélenchon c'est ailleurs ce que je vais faire, mais prétendre que c'est mieux que le Pen soit au second tour c'est vraiment de la merde en paquet.",None,None,None,NO,NO,NO,NO,NO,NO,NO,NO,NO
5296300,227,"This is one of the conditions for me to vote for you; Mélenchon, Prime Minister. But what guarantee do you give, other than blah blah blah, no written guarantee?","c'est une des conditions pour que je vote pour vous; Mélenchon ,premier ministre. Mais quelle garantie vous donnez, sinon du blablabla, aucune garantie écrite",None,None,None,NO,NO,NO,NO,NO,NO,NO,NO,NO
2178796,228,"I think it's sincere, as they really believed that Mélenchon could succeed. I'm not throwing stones at them, I respect them. I tried to warn them, but I don't carry any weight. We'll see the return of the beavers.","Je pense que  est sincère comme  ils croyaient vraiment que Mélenchon pouvait passer, je ne leur jette pas la pierre, je les estime, j'ai tenté de les prévenir mais je ne pèse rien. On va voir le retour des castors.",None,None,None,NO,NO,NO,NO,NO,NO,NO,NO,NO
568095,229,"Hello, I am a professional graphic designer (vote Mélenchon)",Bonjour je suis graphiste professionnel (votez Mélenchon),Mélenchon,None,Mélenchon,NO,NO,YES,NO,NO,NO,NO,NO,YES
3442848,230,"I say the opposite of you, B.F. If we love France, we vote for Mélenchon so that the country's motto is truly applied: liberty, equality, fraternity!","Moi, je dits le contraire de vous B.F, si on aime la France on vote Mélenchon pour que la devise du pays soit appliquée pour de vrai : liberté, égalité, fraternité !",Mélenchon,None,Mélenchon,NO,NO,YES,NO,NO,NO,NO,NO,YES
3475820,231,"Myriam, I too am very angry about the result, there was a rigging, we should have had Mélenchon Macron. In 2017 I voted for Macron and I still regret it, there is no way I will give my vote to the FN. I will not go to vote, think carefully, you will regret it all your life","Myriam,moi aussi je suis très en colère du résultat,il y a eu trucage on aurait dû avoir Mélenchon Macron.En 2017 g voté Macron au2ntour et je le regrette encore,il est hors2question que je donne ma voix au FN. Je n'irai pas voter réfléchissez bien,vs le regretterez tte votre vie",None,None,None,NO,NO,NO,NO,NO,NO,NO,NO,NO
3815227,232,"Yes, of course I'm going to vote for Mélenchon and throw Macron's crook in the trash.",Oui bien sûr que je vais voter pour Mélenchon et le truand de Macron à la poubelle.,Mélenchon,Macron,Mélenchon,NO,NO,YES,YES,NO,NO,NO,NO,YES
2829697,233,"The most precise results for Bordeaux came in a few moments ago. Mélenchon won the voting blocks in the south (St-Michel, St-Jean station), the east (right bank), the north (Grand Parc, Bdx-Lac) + most of the quays (reclassified under Juppé and a showcase of his power).","Les résultats + précis pour Bordeaux sont tombés il y a qqls instants.  Mélenchon remporte les b. de vote au sud (St-Michel, gare St-Jean), à l'est (rive droite), au nord (Grand Parc, Bdx-Lac) + la majeure partie des quais (requalifiés sous Juppé et vitrine de son pouvoir) ",None,None,None,NO,NO,NO,NO,NO,NO,NO,NO,NO
1734640,234,"Uh, Mélenchon was also in government. Cohabitation always works to the President's advantage, because he's positioned as an arbiter. I'm for Macron and I think it would be best for him.","Heu Mélenchon aussi a été au gouvernement. La cohabitation tourne toujours à l'avantage du Président, car du coup il est positionné comme un arbitre. Je suis pour Macron et je trouve que ce serai le mieux pour lui.",Macron,None,Macron,YES,NO,NO,NO,NO,NO,YES,NO,NO
2001833,235,"I said yesterday that I was close to voting for Mélenchon to have him vs Macron in the second round, why would I be on a crusade for Inès?","J'ai dit hier que j'étais proche de voter Mélenchon pour avoir lui vs Macron au 2nd tour, pourquoi je serais en croisade Inès ?",Mélenchon,None,None,NO,NO,YES,NO,NO,NO,NO,NO,NO
3382779,236,"Thanks for the info, your tweet reassures me. Because if a large number voted for Mélenchon in the first round, I can hardly imagine, even if I could be wrong, these same young people giving their trust to Mrs. Le Pen.",Merci pour l'info votre tweet me rassure . Car si pour un grand nombre ont voté Mélenchon au premier tour . J'imagine mal même si je peux me tromper ces même jeunes accorder leur confiance à Mme Le Pen .,None,None,None,NO,NO,NO,NO,NO,NO,NO,NO,NO
2258031,237,"I'm going to vote for Mélenchon because I believe it's time to pick up the cards, reshuffle them, redistribute them, define new rules of the game together, and let a new game begin. That's it. Melenchon2022","Je vais voter Mélenchon parce que j'estime qu'il est temps de ramasser les cartes, de les rebattre, de les redistribuer, de définir ensemble de nouvelles règles du jeu et qu'une nouvelle partie commence. Voilà. Melenchon2022",Mélenchon,None,Mélenchon,NO,NO,YES,NO,NO,NO,NO,NO,YES
4981041,238,Voting among those over 70: - Macron 41% - Le Pen 13% - Pécresse 12% - Mélenchon 9% Macron's youthful and dynamic side appeals especially to older people.,Vote chez les plus de 70 ans :  - Macron 41% - Le Pen 13% - Pécresse 12% - Mélenchon 9% Le côté jeune et dynamique de Macron plaît surtout aux vieux.,None,None,None,NO,NO,NO,NO,NO,NO,NO,NO,NO
3170794,239,"But stop talking DIRTY BIG SHIT ""I'm not talking about Mélenchon but about Macron"" WAS THAT COMPLICATED??? DIRTY FUCKING GOLMON??? Instead: ""gndugnnn trouduku areu areuu connifif matroquaje defirivé inteloctuel imam capitaliste"" AHAHAHAHAHAH","Mais arrête de parler SALE GROSSE MERDE  ""Je ne parle pas de Mélenchon mais de Macron"" C'ETAIT COMPLIQUÉ ÇA ??? SALE PUTAIN DE GOLMON ???  A la place : ""gndugnnn trouduku areu areuu connifif matroquaje defirivé inteloctuel imam capitaloste"" AHAHAHAHAHAH ",None,None,None,NO,NO,NO,NO,NO,NO,NO,NO,NO
2033625,240,"I would have voted for Egger or Asselineau if they had the signatures (even if I have 2 different opinions on nuclear power and China), I only remember 4 out of 12: Lassale and Poutou for honesty, NDA for his positions on the health dictatorship and Mélenchon to get rid of Macron.","J'aurais voter Egger ou Asselineau s'ils avaient eu les signatures (même si j'ai 2 différents sur le nucléaire et la Chine), je n'en retiens que 4 sur les 12 : Lassale et Poutou pour l'honnêteté, NDA pour ses positions sur la dictature sanitaire et Mélenchon pour dégager macron.",None,None,None,NO,NO,NO,NO,NO,NO,NO,NO,NO
5741424,241,"What did you do? Know that Mr. Mélenchon did not give a voting order, directly to vote Macron he was vague I think that Mr. Mélenchon is happy that Marine Le Pen comes to power out of revenge to divide to better reign You speak Chinese","vous avez fait quoi sachez que Monsieur Mélenchon n'a pas donné d'ordre de vote, direct à voter Macron il a été vague moi je pense que Monsieur Mélenchon  content que  Marine Le Pen passe au pouvoir par vengeance désunir pour mieux régner Vous parlez chinois",None,None,None,NO,NO,NO,NO,NO,NO,NO,NO,NO
5805449,242,"In my opinion, Jadot would have been justified in saying ""I'm withdrawing to support Mélenchon."" From an environmental point of view, it must be said that the AEC is much more up to date than Jadot's program. The same goes for the ""social"" part of the Socialist Party candidate.","À mes yeux Jadot aurait été légitime de dire ""je me retire pour soutenir Mélenchon"", d'un point de vue écolo, faut se le dire, L'AEC est beaucoup plus au point que le programme de Jadot. Pareil sur la partie ""social"" de la candidate du Parti Socialiste.",None,None,None,NO,NO,NO,NO,NO,NO,NO,NO,NO
